{
  "benchmark_version": "0.1.0",
  "schema_version": "0.1",
  "verdict": "EXPLOITABLE",
  "reason_code": "REACHABLE_TO_SINK",
  "confidence": 1,
  "rationale": "Synthetic build hook executes with build identity.",
  "claim_ids": [
    "CLM-011-001"
  ],
  "evidence_ids": [
    "EVD-011-001"
  ],
  "attack_path_ids": [
    "P-011-001"
  ]
}
