{
  "benchmark_version": "0.1.0",
  "schema_version": "0.1",
  "verdict": "REMEDIATED",
  "reason_code": "REMEDIATION_BREAKS_PATH",
  "confidence": 1,
  "rationale": "Verified signature control breaks the original path.",
  "claim_ids": [
    "CLM-019-001"
  ],
  "evidence_ids": [
    "EVD-019-001"
  ],
  "attack_path_ids": [
    "P-019-001"
  ]
}
