{
  "benchmark_version": "0.1.0",
  "schema_version": "0.1",
  "verdict": "EXPLOITABLE",
  "reason_code": "REACHABLE_TO_SINK",
  "confidence": 1,
  "rationale": "Indirect data flow reaches the command sink.",
  "claim_ids": [
    "CLM-004-001"
  ],
  "evidence_ids": [
    "EVD-004-001"
  ],
  "attack_path_ids": [
    "P-004-001"
  ]
}
