{
  "benchmark_version": "0.1.0",
  "schema_version": "0.1",
  "verdict": "UNKNOWN",
  "reason_code": "INSUFFICIENT_EVIDENCE",
  "confidence": 0.5,
  "rationale": "Evidence does not establish effective reachability.",
  "claim_ids": [
    "CLM-012-001"
  ],
  "evidence_ids": [
    "EVD-012-001"
  ],
  "attack_path_ids": [
    "P-012-001"
  ]
}
