{
  "benchmark_version": "0.1.0",
  "schema_version": "0.1",
  "verdict": "EXPLOITABLE",
  "reason_code": "REACHABLE_TO_SINK",
  "confidence": 1,
  "rationale": "Live synthetic credential completes the attack path.",
  "claim_ids": [
    "CLM-014-001"
  ],
  "evidence_ids": [
    "EVD-014-001"
  ],
  "attack_path_ids": [
    "P-014-001"
  ]
}
