{
  "benchmark_version": "0.1.0",
  "schema_version": "0.1",
  "verdict": "NOT_EXPLOITABLE",
  "reason_code": "BLOCKED_BY_RESOURCE_POLICY",
  "confidence": 1,
  "rationale": "Effective explicit deny blocks privilege escalation.",
  "claim_ids": [
    "CLM-016-001"
  ],
  "evidence_ids": [
    "EVD-016-001"
  ],
  "attack_path_ids": [
    "P-016-001"
  ]
}
