{
  "benchmark_version": "0.1.0",
  "schema_version": "0.1",
  "verdict": "CONDITIONALLY_EXPLOITABLE",
  "reason_code": "MISSING_PREREQUISITE",
  "confidence": 1,
  "rationale": "Sandbox escape requires the explicitly supplied prerequisite.",
  "claim_ids": [
    "CLM-008-001"
  ],
  "evidence_ids": [
    "EVD-008-001"
  ],
  "attack_path_ids": [
    "P-008-001"
  ],
  "conditions": [
    {
      "prerequisite": "Synthetic namespace-escape prerequisite",
      "satisfied": true,
      "evidence_ids": [
        "EVD-008-001"
      ]
    }
  ]
}
