{
  "benchmark_version": "0.1.0",
  "schema_version": "0.1",
  "verdict": "NOT_EXPLOITABLE",
  "reason_code": "BLOCKED_BY_VALIDATION",
  "confidence": 1,
  "rationale": "Argument boundary prevents command interpretation.",
  "claim_ids": [
    "CLM-003-001"
  ],
  "evidence_ids": [
    "EVD-003-001"
  ],
  "attack_path_ids": [
    "P-003-001"
  ]
}
