{
  "benchmark_version": "0.1.0",
  "schema_version": "0.1",
  "verdict": "NOT_EXPLOITABLE",
  "reason_code": "BLOCKED_BY_AUTHORIZATION",
  "confidence": 1,
  "rationale": "Effective authorization blocks the candidate path.",
  "claim_ids": [
    "CLM-010-001"
  ],
  "evidence_ids": [
    "EVD-010-001"
  ],
  "attack_path_ids": [
    "P-010-001"
  ]
}
