{
  "benchmark_version": "0.1.0",
  "schema_version": "0.1",
  "verdict": "EXPLOITABLE",
  "reason_code": "CONTROL_BYPASS",
  "confidence": 1,
  "rationale": "Effective public storage state is accessible anonymously.",
  "claim_ids": [
    "CLM-015-001"
  ],
  "evidence_ids": [
    "EVD-015-001"
  ],
  "attack_path_ids": [
    "P-015-001"
  ]
}
