{
  "benchmark_version": "0.1.0",
  "schema_version": "0.1",
  "verdict": "REMEDIATED",
  "reason_code": "REMEDIATION_BREAKS_PATH",
  "confidence": 1,
  "rationale": "Historical credential is revoked and cannot authenticate.",
  "claim_ids": [
    "CLM-013-001"
  ],
  "evidence_ids": [
    "EVD-013-001"
  ],
  "attack_path_ids": [
    "P-013-001"
  ]
}
