{
  "benchmark_version": "0.1.0",
  "schema_version": "0.1",
  "verdict": "REMEDIATION_FAILED",
  "reason_code": "REMEDIATION_LEAVES_ALTERNATE_PATH",
  "confidence": 1,
  "rationale": "The original path is blocked but an alternate path remains viable.",
  "claim_ids": [
    "CLM-020-001"
  ],
  "evidence_ids": [
    "EVD-020-001"
  ],
  "attack_path_ids": [
    "P-020-001"
  ]
}
