{
  "benchmark_version": "0.1.0",
  "schema_version": "0.1",
  "verdict": "NOT_EXPLOITABLE",
  "reason_code": "BLOCKED_BY_NETWORK_POLICY",
  "confidence": 0.93,
  "rationale": "The effective allowlist blocks the sink transition.",
  "claim_ids": [
    "CLM-001"
  ],
  "evidence_ids": [
    "EVD-001"
  ],
  "attack_path_ids": [
    "P-1"
  ]
}