{
  "benchmark_version": "0.1.0",
  "schema_version": "0.1",
  "verdict": "EXPLOITABLE",
  "reason_code": "REACHABLE_TO_SINK",
  "confidence": 1,
  "rationale": "Observed viable attack path reaches impact.",
  "claim_ids": [
    "CLM-005-001"
  ],
  "evidence_ids": [
    "EVD-005-001"
  ],
  "attack_path_ids": [
    "P-005-001"
  ]
}
