{
  "benchmark_version": "0.1.0",
  "schema_version": "0.1",
  "verdict": "EXPLOITABLE",
  "reason_code": "CONTROL_BYPASS",
  "confidence": 1,
  "rationale": "Synthetic agent-to-CI-to-production path is viable.",
  "claim_ids": [
    "CLM-018-001"
  ],
  "evidence_ids": [
    "EVD-018-001"
  ],
  "attack_path_ids": [
    "P-018-001"
  ]
}
